{
  "uacp_encrypted": "0.3.0",
  "algorithm": "aes-256-gcm",
  "iv": "a1b2c3d4e5f60708090a0b0c",
  "auth_tag": "deadbeefdeadbeefdeadbeefdeadbeef",
  "ciphertext": "00112233445566778899aabbccddeeff00112233445566778899aabbccddeeff",
  "aad": "",
  "key_derivation": {
    "method": "argon2id+hkdf",
    "salt": "c2FsdHNhbHRzYWx0c2FsdA",
    "argon2id": { "m": 65536, "t": 3, "p": 1, "output_length": 32 },
    "hkdf":     { "hash": "sha256", "output_length": 32 },
    "info":     "uacp-key-v1"
  }
}
